"item_id","source_platform","source_platform_url","id","code","is_paid_partnership","original_height","original_width","comment_count","counts_disabled","like_count","product_type","media_type","carousel_media_count","has_audio","caption_text","username","profile_pic_url","full_name"
"3481858560212915176_212658006","instagram.com","https://www.instagram.com/kamalaharris/",2963,"DBSC-mvpNPo",FALSE,1920,1080,2768,FALSE,80384,"clips",2,NA,TRUE,"Yes, I know the memes.","kamalaharris","https://instagram.fagc3-2.fna.fbcdn.net/v/t51.2885-19/315353409_535921751294881_4558053708465640219_n.jpg?stp=dst-jpg_s150x150_tt6&_nc_ht=instagram.fagc3-2.fna.fbcdn.net&_nc_cat=1&_nc_oc=Q6cZ2QEZFlom_tg-GlbvR-OLkGLz8rjlqWEQDPaKQzECT5Ye-x3oax7ythWKUyCG8f0mZQI&_nc_ohc=8TNz_cljzU8Q7kNvwGsDojS&_nc_gid=a8jjpEerc_UxKmclttD1gA&edm=APoiHPcBAAAA&ccb=7-5&oh=00_AfL27jAh397QISy3xIohX6J-z4Ln9T6_H8wNHkDHmyHRTQ&oe=683BCA08&_nc_sid=22de04","Kamala Harris"
"3481809617962731994_212658006","instagram.com","https://www.instagram.com/kamalaharris/",2964,"DBR32ZuNQna",FALSE,1350,1080,2024,FALSE,41674,"clips",2,NA,TRUE,"If Donald Trump is dodging debates and ducking interviews because of “exhaustion,” is he fit for the toughest job in the world?","kamalaharris","https://instagram.fagc3-2.fna.fbcdn.net/v/t51.2885-19/315353409_535921751294881_4558053708465640219_n.jpg?stp=dst-jpg_s150x150_tt6&_nc_ht=instagram.fagc3-2.fna.fbcdn.net&_nc_cat=1&_nc_oc=Q6cZ2QEZFlom_tg-GlbvR-OLkGLz8rjlqWEQDPaKQzECT5Ye-x3oax7ythWKUyCG8f0mZQI&_nc_ohc=8TNz_cljzU8Q7kNvwGsDojS&_nc_gid=a8jjpEerc_UxKmclttD1gA&edm=APoiHPcBAAAA&ccb=7-5&oh=00_AfL27jAh397QISy3xIohX6J-z4Ln9T6_H8wNHkDHmyHRTQ&oe=683BCA08&_nc_sid=22de04","Kamala Harris"
"3481781988665158890_212658006","instagram.com","https://www.instagram.com/kamalaharris/",2965,"DBRxkV7vWzq",FALSE,1920,1080,10445,FALSE,318925,"clips",2,NA,TRUE,"Under my presidency, we will stand united regardless of where we’re from.

Thank you, @MarcAnthony, for your support.","kamalaharris","https://instagram.fagc3-2.fna.fbcdn.net/v/t51.2885-19/315353409_535921751294881_4558053708465640219_n.jpg?stp=dst-jpg_s150x150_tt6&_nc_ht=instagram.fagc3-2.fna.fbcdn.net&_nc_cat=1&_nc_oc=Q6cZ2QEZFlom_tg-GlbvR-OLkGLz8rjlqWEQDPaKQzECT5Ye-x3oax7ythWKUyCG8f0mZQI&_nc_ohc=8TNz_cljzU8Q7kNvwGsDojS&_nc_gid=a8jjpEerc_UxKmclttD1gA&edm=APoiHPcBAAAA&ccb=7-5&oh=00_AfL27jAh397QISy3xIohX6J-z4Ln9T6_H8wNHkDHmyHRTQ&oe=683BCA08&_nc_sid=22de04","Kamala Harris"
"3481779395796722331_11344275060","instagram.com","https://www.instagram.com/kamalaharris/",2966,"DBRw-nIvOKb",FALSE,1080,1440,1544,FALSE,91901,"feed",1,NA,NA,"She’s ready to get stuff done for the American people and so are we. We’ve got your back, @kamalaharris. Let’s go!","whitmermi","https://scontent-lga3-2.cdninstagram.com/v/t51.2885-19/275969467_657816952141321_4588607513908499906_n.jpg?stp=dst-jpg_s150x150_tt6&_nc_ht=scontent-lga3-2.cdninstagram.com&_nc_cat=101&_nc_oc=Q6cZ2QEZFlom_tg-GlbvR-OLkGLz8rjlqWEQDPaKQzECT5Ye-x3oax7ythWKUyCG8f0mZQI&_nc_ohc=5iWVxqYoD-QQ7kNvwFa53iO&_nc_gid=a8jjpEerc_UxKmclttD1gA&edm=APoiHPcBAAAA&ccb=7-5&oh=00_AfLlciw6zT-vZo3l8dd4alzOAYdXMMOLgX61EHDOA5QgEA&oe=683BDAD4&_nc_sid=22de04","Gretchen Whitmer"
"3481769865917287405_212658006","instagram.com","https://www.instagram.com/kamalaharris/",2967,"DBRuz7vqMvt",FALSE,1920,1080,678,FALSE,19180,"clips",2,NA,TRUE,"We are fighting for a better future for working families, like the ones @TimWalz and I come from. And we know that when unions are strong, America is strong. 

I am honored to have the support of the @UAW.Union in this election.","kamalaharris","https://instagram.fagc3-2.fna.fbcdn.net/v/t51.2885-19/315353409_535921751294881_4558053708465640219_n.jpg?stp=dst-jpg_s150x150_tt6&_nc_ht=instagram.fagc3-2.fna.fbcdn.net&_nc_cat=1&_nc_oc=Q6cZ2QEZFlom_tg-GlbvR-OLkGLz8rjlqWEQDPaKQzECT5Ye-x3oax7ythWKUyCG8f0mZQI&_nc_ohc=8TNz_cljzU8Q7kNvwGsDojS&_nc_gid=a8jjpEerc_UxKmclttD1gA&edm=APoiHPcBAAAA&ccb=7-5&oh=00_AfL27jAh397QISy3xIohX6J-z4Ln9T6_H8wNHkDHmyHRTQ&oe=683BCA08&_nc_sid=22de04","Kamala Harris"
"3481745348978587147_212658006","instagram.com","https://www.instagram.com/kamalaharris/",2968,"DBRpPKkPLYL",FALSE,1920,1080,17018,FALSE,514064,"clips",2,NA,TRUE,"Thanks for breaking it down, @mcuban: I have a plan to actually grow our economy. Trump has a plan to raise costs for working and middle-class Americans.","kamalaharris","https://instagram.fagc3-2.fna.fbcdn.net/v/t51.2885-19/315353409_535921751294881_4558053708465640219_n.jpg?stp=dst-jpg_s150x150_tt6&_nc_ht=instagram.fagc3-2.fna.fbcdn.net&_nc_cat=1&_nc_oc=Q6cZ2QEZFlom_tg-GlbvR-OLkGLz8rjlqWEQDPaKQzECT5Ye-x3oax7ythWKUyCG8f0mZQI&_nc_ohc=8TNz_cljzU8Q7kNvwGsDojS&_nc_gid=a8jjpEerc_UxKmclttD1gA&edm=APoiHPcBAAAA&ccb=7-5&oh=00_AfL27jAh397QISy3xIohX6J-z4Ln9T6_H8wNHkDHmyHRTQ&oe=683BCA08&_nc_sid=22de04","Kamala Harris"
"3481729498728816201_212658006","instagram.com","https://www.instagram.com/kamalaharris/",2969,"DBRlog3ut5J",FALSE,1080,1080,2329,FALSE,122294,"feed",1,NA,NA,"Billionaires shouldn’t pay a lower tax rate than working class Americans.","kamalaharris","https://instagram.fagc3-2.fna.fbcdn.net/v/t51.2885-19/315353409_535921751294881_4558053708465640219_n.jpg?stp=dst-jpg_s150x150_tt6&_nc_ht=instagram.fagc3-2.fna.fbcdn.net&_nc_cat=1&_nc_oc=Q6cZ2QGdsvP_TUepgzEsuBrIkJOj9mHxBM9XFcs7dRq0Gsc8FGjtF6YAy-gNGitxuUq5QVI&_nc_ohc=8TNz_cljzU8Q7kNvwGsDojS&_nc_gid=r1LnTPoTXITQXn4k59V_1g&edm=APoiHPcBAAAA&ccb=7-5&oh=00_AfJ2Exo7Cu-foQrMHDLU4tPY7zmVnnbt1l5VofJ-OoRjrw&oe=683BCA08&_nc_sid=22de04","Kamala Harris"
"3481629842325607176_212658006","instagram.com","https://www.instagram.com/kamalaharris/",2970,"DBRO-UnN5MI",FALSE,1080,1080,2356,FALSE,229078,"feed",1,NA,NA,"We cannot stay on the sidelines in this election. 

Knock on doors. 
Make phone calls. 
Talk to your friends and neighbors.

Every connection counts.","kamalaharris","https://instagram.fagc3-2.fna.fbcdn.net/v/t51.2885-19/315353409_535921751294881_4558053708465640219_n.jpg?stp=dst-jpg_s150x150_tt6&_nc_ht=instagram.fagc3-2.fna.fbcdn.net&_nc_cat=1&_nc_oc=Q6cZ2QGdsvP_TUepgzEsuBrIkJOj9mHxBM9XFcs7dRq0Gsc8FGjtF6YAy-gNGitxuUq5QVI&_nc_ohc=8TNz_cljzU8Q7kNvwGsDojS&_nc_gid=r1LnTPoTXITQXn4k59V_1g&edm=APoiHPcBAAAA&ccb=7-5&oh=00_AfJ2Exo7Cu-foQrMHDLU4tPY7zmVnnbt1l5VofJ-OoRjrw&oe=683BCA08&_nc_sid=22de04","Kamala Harris"
"3481564417039498993_212658006","instagram.com","https://www.instagram.com/kamalaharris/",2971,"DBRAGQkR37x",FALSE,1440,1440,1814,FALSE,76683,"feed",1,NA,NA,"As imperfect as we may be, America is still that shining city upon a hill that inspires people around the world.

We know the deep privilege and pride that comes with being an American and what it means to love our country. And we will continue to fight for the ideals of our country.","kamalaharris","https://instagram.fagc3-2.fna.fbcdn.net/v/t51.2885-19/315353409_535921751294881_4558053708465640219_n.jpg?stp=dst-jpg_s150x150_tt6&_nc_ht=instagram.fagc3-2.fna.fbcdn.net&_nc_cat=1&_nc_oc=Q6cZ2QGdsvP_TUepgzEsuBrIkJOj9mHxBM9XFcs7dRq0Gsc8FGjtF6YAy-gNGitxuUq5QVI&_nc_ohc=8TNz_cljzU8Q7kNvwGsDojS&_nc_gid=r1LnTPoTXITQXn4k59V_1g&edm=APoiHPcBAAAA&ccb=7-5&oh=00_AfJ2Exo7Cu-foQrMHDLU4tPY7zmVnnbt1l5VofJ-OoRjrw&oe=683BCA08&_nc_sid=22de04","Kamala Harris"
"3481283325354060044_212658006","instagram.com","https://www.instagram.com/kamalaharris/",2972,"DBQAL1iOCkM",FALSE,1080,1920,6680,FALSE,179759,"clips",2,NA,TRUE,"@theofficialsuperstar, thank you for the advice on my speech tonight.

The Gospel of Luke tells us that faith has the power to shine a light in the darkness and to guide our feet in the path of peace. 

In the spirit of Alfred Smith’s legacy, let us fight to build toward a better future with faith in God, our country, and each other.","kamalaharris","https://instagram.fagc3-2.fna.fbcdn.net/v/t51.2885-19/315353409_535921751294881_4558053708465640219_n.jpg?stp=dst-jpg_s150x150_tt6&_nc_ht=instagram.fagc3-2.fna.fbcdn.net&_nc_cat=1&_nc_oc=Q6cZ2QGdsvP_TUepgzEsuBrIkJOj9mHxBM9XFcs7dRq0Gsc8FGjtF6YAy-gNGitxuUq5QVI&_nc_ohc=8TNz_cljzU8Q7kNvwGsDojS&_nc_gid=r1LnTPoTXITQXn4k59V_1g&edm=APoiHPcBAAAA&ccb=7-5&oh=00_AfJ2Exo7Cu-foQrMHDLU4tPY7zmVnnbt1l5VofJ-OoRjrw&oe=683BCA08&_nc_sid=22de04","Kamala Harris"
"3481268535634174606_212658006","instagram.com","https://www.instagram.com/kamalaharris/",2973,"DBP80niOCKO",FALSE,1920,1080,3797,FALSE,73799,"clips",2,NA,TRUE,"There was nothing “peaceful or patriotic” about what happened on January 6.

Donald Trump lost the 2020 election. With your support, we will defeat him and his dangerous agenda once again.","kamalaharris","https://instagram.fagc3-2.fna.fbcdn.net/v/t51.2885-19/315353409_535921751294881_4558053708465640219_n.jpg?stp=dst-jpg_s150x150_tt6&_nc_ht=instagram.fagc3-2.fna.fbcdn.net&_nc_cat=1&_nc_oc=Q6cZ2QGdsvP_TUepgzEsuBrIkJOj9mHxBM9XFcs7dRq0Gsc8FGjtF6YAy-gNGitxuUq5QVI&_nc_ohc=8TNz_cljzU8Q7kNvwGsDojS&_nc_gid=r1LnTPoTXITQXn4k59V_1g&edm=APoiHPcBAAAA&ccb=7-5&oh=00_AfJ2Exo7Cu-foQrMHDLU4tPY7zmVnnbt1l5VofJ-OoRjrw&oe=683BCA08&_nc_sid=22de04","Kamala Harris"
"3481256764746590615_212658006","instagram.com","https://www.instagram.com/kamalaharris/",2974,"DBP6JVCpWmX",FALSE,1350,1080,2201,FALSE,57214,"clips",2,NA,TRUE,"When you listen to Donald Trump talk, it becomes increasingly clear: He has no idea what he’s talking about when it comes to women’s health care.","kamalaharris","https://instagram.fagc3-2.fna.fbcdn.net/v/t51.2885-19/315353409_535921751294881_4558053708465640219_n.jpg?stp=dst-jpg_s150x150_tt6&_nc_ht=instagram.fagc3-2.fna.fbcdn.net&_nc_cat=1&_nc_oc=Q6cZ2QGdsvP_TUepgzEsuBrIkJOj9mHxBM9XFcs7dRq0Gsc8FGjtF6YAy-gNGitxuUq5QVI&_nc_ohc=8TNz_cljzU8Q7kNvwGsDojS&_nc_gid=r1LnTPoTXITQXn4k59V_1g&edm=APoiHPcBAAAA&ccb=7-5&oh=00_AfJ2Exo7Cu-foQrMHDLU4tPY7zmVnnbt1l5VofJ-OoRjrw&oe=683BCA08&_nc_sid=22de04","Kamala Harris"
"3481169533383673944_212658006","instagram.com","https://www.instagram.com/kamalaharris/",2975,"DBPmT8gPwhY",FALSE,612,612,1829,FALSE,138405,"carousel_container",8,4,NA,"In 1776, General George Washington crossed the icy Delaware River in darkness, achieving a major victory in the American Revolution. Not too far from that very location, delegates from across the nation gathered to compose the Constitution of the United States.

Our nation’s founders often disagreed, but as they wrote our Constitution, they laid out the foundation of our democracy, including the rule of law, checks and balances, free and fair elections, and a peaceful transfer of power. These principles and traditions have sustained our nation for over two centuries. Americans from all backgrounds and beliefs have cherished, upheld, and defended them. 

Yesterday, I proudly stood in that same place in Washington Crossing, Pennsylvania, with over 100 Republican leaders from across our nation who are supporting my candidacy for President of the United States. Those who formerly worked with Presidents George W. Bush, George H.W. Bush, and Ronald Reagan, as well as Mitt Romney, John McCain, and even members of Donald Trump’s own administration. 

We may not agree on everything. But we share a core belief that our democratic ideals are at stake in this election—ideals that our founders and generations of Americans before us have fought for. Now, the baton is in our hands. I am grateful to each person who has decided to put our country before party.

This November, with your help, we will write the next great chapter in the most extraordinary story ever told.","kamalaharris","https://instagram.fagc3-2.fna.fbcdn.net/v/t51.2885-19/315353409_535921751294881_4558053708465640219_n.jpg?stp=dst-jpg_s150x150_tt6&_nc_ht=instagram.fagc3-2.fna.fbcdn.net&_nc_cat=1&_nc_oc=Q6cZ2QGdsvP_TUepgzEsuBrIkJOj9mHxBM9XFcs7dRq0Gsc8FGjtF6YAy-gNGitxuUq5QVI&_nc_ohc=8TNz_cljzU8Q7kNvwGsDojS&_nc_gid=r1LnTPoTXITQXn4k59V_1g&edm=APoiHPcBAAAA&ccb=7-5&oh=00_AfJ2Exo7Cu-foQrMHDLU4tPY7zmVnnbt1l5VofJ-OoRjrw&oe=683BCA08&_nc_sid=22de04","Kamala Harris"
"3481141633141212296_212658006","instagram.com","https://www.instagram.com/kamalaharris/",2976,"DBPf98YNISI",FALSE,1080,1080,817,FALSE,23234,"feed",1,NA,NA,"Assistance is available for people affected by Hurricanes Helene and Milton. Our administration is on the ground to help you recover and rebuild as soon as possible.","kamalaharris","https://instagram.fagc3-2.fna.fbcdn.net/v/t51.2885-19/315353409_535921751294881_4558053708465640219_n.jpg?stp=dst-jpg_s150x150_tt6&_nc_ht=instagram.fagc3-2.fna.fbcdn.net&_nc_cat=1&_nc_oc=Q6cZ2QGdsvP_TUepgzEsuBrIkJOj9mHxBM9XFcs7dRq0Gsc8FGjtF6YAy-gNGitxuUq5QVI&_nc_ohc=8TNz_cljzU8Q7kNvwGsDojS&_nc_gid=r1LnTPoTXITQXn4k59V_1g&edm=APoiHPcBAAAA&ccb=7-5&oh=00_AfJ2Exo7Cu-foQrMHDLU4tPY7zmVnnbt1l5VofJ-OoRjrw&oe=683BCA08&_nc_sid=22de04","Kamala Harris"
"3481125154576446229_212658006","instagram.com","https://www.instagram.com/kamalaharris/",2977,"DBPcOJhNLMV",FALSE,1350,1080,2670,FALSE,63802,"clips",2,NA,TRUE,"Last night, a voter asked Donald Trump about January 6—a tragic day of violence where 140 law enforcement officers were injured and some were killed. Trump called it “a day of love.” 

The American people are exhausted with his gaslighting.","kamalaharris","https://instagram.fagc3-2.fna.fbcdn.net/v/t51.2885-19/315353409_535921751294881_4558053708465640219_n.jpg?stp=dst-jpg_s150x150_tt6&_nc_ht=instagram.fagc3-2.fna.fbcdn.net&_nc_cat=1&_nc_oc=Q6cZ2QGdsvP_TUepgzEsuBrIkJOj9mHxBM9XFcs7dRq0Gsc8FGjtF6YAy-gNGitxuUq5QVI&_nc_ohc=8TNz_cljzU8Q7kNvwGsDojS&_nc_gid=r1LnTPoTXITQXn4k59V_1g&edm=APoiHPcBAAAA&ccb=7-5&oh=00_AfJ2Exo7Cu-foQrMHDLU4tPY7zmVnnbt1l5VofJ-OoRjrw&oe=683BCA08&_nc_sid=22de04","Kamala Harris"
"3481057571847491953_212658006","instagram.com","https://www.instagram.com/kamalaharris/",2978,"DBPM2sMp1Fx",FALSE,1080,1080,2590,FALSE,206459,"feed",1,NA,NA,"Growing up, our mother worked long hours, so my sister Maya and I would stay with our neighbor, Mrs. Shelton. She helped my mother take care of us, and we used to call her our second mother.

Mrs. Shelton was a small business owner. Since I was a child, I have known that small business owners hold the community together. They hire locally, mentor, and are civic leaders.

Americans do not lack ambition, aspiration, dreams, or the preparedness to do hard work. However, not everyone has the resources to turn their dreams into reality. 

That is why part of my economic plan will give a $50,000 tax deduction to help entrepreneurs and innovators start and grow their start-ups and small businesses.","kamalaharris","https://instagram.fagc3-2.fna.fbcdn.net/v/t51.2885-19/315353409_535921751294881_4558053708465640219_n.jpg?stp=dst-jpg_s150x150_tt6&_nc_ht=instagram.fagc3-2.fna.fbcdn.net&_nc_cat=1&_nc_oc=Q6cZ2QGdsvP_TUepgzEsuBrIkJOj9mHxBM9XFcs7dRq0Gsc8FGjtF6YAy-gNGitxuUq5QVI&_nc_ohc=8TNz_cljzU8Q7kNvwGsDojS&_nc_gid=r1LnTPoTXITQXn4k59V_1g&edm=APoiHPcBAAAA&ccb=7-5&oh=00_AfJ2Exo7Cu-foQrMHDLU4tPY7zmVnnbt1l5VofJ-OoRjrw&oe=683BCA08&_nc_sid=22de04","Kamala Harris"
"3480947084595483040_212658006","instagram.com","https://www.instagram.com/kamalaharris/",2979,"DBOzu47PtGg",FALSE,1920,1080,5860,FALSE,142429,"clips",2,NA,TRUE,"Donald Trump has peddled harmful conspiracies about immigrant communities eating pets and spread misinformation about resources available to those impacted by Hurricanes Milton and Helene.

He is a deeply unserious man—but the consequences of him having power are deadly serious.","kamalaharris","https://instagram.fagc3-2.fna.fbcdn.net/v/t51.2885-19/315353409_535921751294881_4558053708465640219_n.jpg?stp=dst-jpg_s150x150_tt6&_nc_ht=instagram.fagc3-2.fna.fbcdn.net&_nc_cat=1&_nc_oc=Q6cZ2QGdsvP_TUepgzEsuBrIkJOj9mHxBM9XFcs7dRq0Gsc8FGjtF6YAy-gNGitxuUq5QVI&_nc_ohc=8TNz_cljzU8Q7kNvwGsDojS&_nc_gid=r1LnTPoTXITQXn4k59V_1g&edm=APoiHPcBAAAA&ccb=7-5&oh=00_AfJ2Exo7Cu-foQrMHDLU4tPY7zmVnnbt1l5VofJ-OoRjrw&oe=683BCA08&_nc_sid=22de04","Kamala Harris"
"3480911622718895479_212658006","instagram.com","https://www.instagram.com/kamalaharris/",2980,"DBOrq2esDV3",FALSE,1080,1080,1600,FALSE,33517,"feed",1,NA,NA,"North Carolina, your vote is your voice. Not registered? You can register and vote in one visit. 

Comment your voting plan and tag a friend to do the same.","kamalaharris","https://instagram.fagc3-2.fna.fbcdn.net/v/t51.2885-19/315353409_535921751294881_4558053708465640219_n.jpg?stp=dst-jpg_s150x150_tt6&_nc_ht=instagram.fagc3-2.fna.fbcdn.net&_nc_cat=1&_nc_oc=Q6cZ2QGdsvP_TUepgzEsuBrIkJOj9mHxBM9XFcs7dRq0Gsc8FGjtF6YAy-gNGitxuUq5QVI&_nc_ohc=8TNz_cljzU8Q7kNvwGsDojS&_nc_gid=r1LnTPoTXITQXn4k59V_1g&edm=APoiHPcBAAAA&ccb=7-5&oh=00_AfJ2Exo7Cu-foQrMHDLU4tPY7zmVnnbt1l5VofJ-OoRjrw&oe=683BCA08&_nc_sid=22de04","Kamala Harris"
"3480879474847206721_212658006","instagram.com","https://www.instagram.com/kamalaharris/",2981,"DBOkXCcN01B",FALSE,1920,1080,1423,FALSE,33453,"clips",2,NA,TRUE,"When I look at our aspiring business leaders, I know our future is bright. 

My economic plan allows entrepreneurs and small business owners to get their foot in the door and turn their dreams into reality.","kamalaharris","https://instagram.fagc3-2.fna.fbcdn.net/v/t51.2885-19/315353409_535921751294881_4558053708465640219_n.jpg?stp=dst-jpg_s150x150_tt6&_nc_ht=instagram.fagc3-2.fna.fbcdn.net&_nc_cat=1&_nc_oc=Q6cZ2QH2w-kJEBBMg9RrULqDw3CPvwFXq4OcYl5S9YHtSLyyMZJLs_U-NIN6GrbeZ90-5a8&_nc_ohc=8TNz_cljzU8Q7kNvwGsDojS&_nc_gid=jbeGK29qs1TOBfwEw8-rfw&edm=APoiHPcBAAAA&ccb=7-5&oh=00_AfJEvjDuxLl2Zo_fgfG3lle08TY9Bg7zg-4Ts90G6kPDPQ&oe=683BCA08&_nc_sid=22de04","Kamala Harris"
"3480570004988523986_212658006","instagram.com","https://www.instagram.com/kamalaharris/",2982,"DBNd_qLOHXS",FALSE,1920,1080,4441,FALSE,66880,"clips",2,NA,TRUE,"Donald Trump said that Black and Latino voters who don’t support him should have their heads examined.

His Project 2025 Agenda would give him virtually unchecked power to implement policies that would disproportionately harm Black and Latino communities.","kamalaharris","https://instagram.fagc3-2.fna.fbcdn.net/v/t51.2885-19/315353409_535921751294881_4558053708465640219_n.jpg?stp=dst-jpg_s150x150_tt6&_nc_ht=instagram.fagc3-2.fna.fbcdn.net&_nc_cat=1&_nc_oc=Q6cZ2QH2w-kJEBBMg9RrULqDw3CPvwFXq4OcYl5S9YHtSLyyMZJLs_U-NIN6GrbeZ90-5a8&_nc_ohc=8TNz_cljzU8Q7kNvwGsDojS&_nc_gid=jbeGK29qs1TOBfwEw8-rfw&edm=APoiHPcBAAAA&ccb=7-5&oh=00_AfJEvjDuxLl2Zo_fgfG3lle08TY9Bg7zg-4Ts90G6kPDPQ&oe=683BCA08&_nc_sid=22de04","Kamala Harris"
"3480500318186248149_212658006","instagram.com","https://www.instagram.com/kamalaharris/",2983,"DBNOJlSIBfV",FALSE,1920,1080,4104,FALSE,152778,"clips",2,NA,TRUE,"I promised Amber’s family that she would not be just a statistic. We will speak her name. 

Nothing can undo or heal the incredible pain Shanette, CJ, and Andrika have endured. But we can do everything in our power to restore reproductive freedom and get rid of Trump’s Abortion Bans to ensure preventable death like hers never happens again.","kamalaharris","https://instagram.fagc3-2.fna.fbcdn.net/v/t51.2885-19/315353409_535921751294881_4558053708465640219_n.jpg?stp=dst-jpg_s150x150_tt6&_nc_ht=instagram.fagc3-2.fna.fbcdn.net&_nc_cat=1&_nc_oc=Q6cZ2QH2w-kJEBBMg9RrULqDw3CPvwFXq4OcYl5S9YHtSLyyMZJLs_U-NIN6GrbeZ90-5a8&_nc_ohc=8TNz_cljzU8Q7kNvwGsDojS&_nc_gid=jbeGK29qs1TOBfwEw8-rfw&edm=APoiHPcBAAAA&ccb=7-5&oh=00_AfJEvjDuxLl2Zo_fgfG3lle08TY9Bg7zg-4Ts90G6kPDPQ&oe=683BCA08&_nc_sid=22de04","Kamala Harris"
"3480468851059708864_212658006","instagram.com","https://www.instagram.com/kamalaharris/",2984,"DBNG_rPOdPA",FALSE,1080,1080,3699,FALSE,54296,"clips",2,NA,TRUE,"My plans for the economy will strengthen our economy. Trump's will make it weaker. 

Those are the facts.","kamalaharris","https://instagram.fagc3-2.fna.fbcdn.net/v/t51.2885-19/315353409_535921751294881_4558053708465640219_n.jpg?stp=dst-jpg_s150x150_tt6&_nc_ht=instagram.fagc3-2.fna.fbcdn.net&_nc_cat=1&_nc_oc=Q6cZ2QH2w-kJEBBMg9RrULqDw3CPvwFXq4OcYl5S9YHtSLyyMZJLs_U-NIN6GrbeZ90-5a8&_nc_ohc=8TNz_cljzU8Q7kNvwGsDojS&_nc_gid=jbeGK29qs1TOBfwEw8-rfw&edm=APoiHPcBAAAA&ccb=7-5&oh=00_AfJEvjDuxLl2Zo_fgfG3lle08TY9Bg7zg-4Ts90G6kPDPQ&oe=683BCA08&_nc_sid=22de04","Kamala Harris"
"3480444603617304435_212658006","instagram.com","https://www.instagram.com/kamalaharris/",2985,"DBNBe1DCN9z",FALSE,1080,1080,16100,FALSE,367513,"clips",2,NA,TRUE,"Donald Trump is unstable, and we should all be concerned.","kamalaharris","https://instagram.fagc3-2.fna.fbcdn.net/v/t51.2885-19/315353409_535921751294881_4558053708465640219_n.jpg?stp=dst-jpg_s150x150_tt6&_nc_ht=instagram.fagc3-2.fna.fbcdn.net&_nc_cat=1&_nc_oc=Q6cZ2QH2w-kJEBBMg9RrULqDw3CPvwFXq4OcYl5S9YHtSLyyMZJLs_U-NIN6GrbeZ90-5a8&_nc_ohc=8TNz_cljzU8Q7kNvwGsDojS&_nc_gid=jbeGK29qs1TOBfwEw8-rfw&edm=APoiHPcBAAAA&ccb=7-5&oh=00_AfJEvjDuxLl2Zo_fgfG3lle08TY9Bg7zg-4Ts90G6kPDPQ&oe=683BCA08&_nc_sid=22de04","Kamala Harris"
"3480435556707515951_212658006","instagram.com","https://www.instagram.com/kamalaharris/",2986,"DBM_bLdML4v",FALSE,1080,1080,4899,FALSE,136052,"clips",2,NA,TRUE,"I am the only person running for president who has prosecuted transnational criminals. I have spent a significant part of my career going after people who present a threat to the safety of the American people. 

I take this work quite seriously.","kamalaharris","https://instagram.fagc3-2.fna.fbcdn.net/v/t51.2885-19/315353409_535921751294881_4558053708465640219_n.jpg?stp=dst-jpg_s150x150_tt6&_nc_ht=instagram.fagc3-2.fna.fbcdn.net&_nc_cat=1&_nc_oc=Q6cZ2QH2w-kJEBBMg9RrULqDw3CPvwFXq4OcYl5S9YHtSLyyMZJLs_U-NIN6GrbeZ90-5a8&_nc_ohc=8TNz_cljzU8Q7kNvwGsDojS&_nc_gid=jbeGK29qs1TOBfwEw8-rfw&edm=APoiHPcBAAAA&ccb=7-5&oh=00_AfJEvjDuxLl2Zo_fgfG3lle08TY9Bg7zg-4Ts90G6kPDPQ&oe=683BCA08&_nc_sid=22de04","Kamala Harris"
"3480404368342817273_212658006","instagram.com","https://www.instagram.com/kamalaharris/",2987,"DBM4VVBypn5",FALSE,1080,864,3420,FALSE,74847,"clips",2,NA,TRUE,"Donald Trump has stated that one of the biggest threats America faces is “the enemy from within.” He has said that as president, he would use our military to go after those who don’t support him.

Use the American military to go after American citizens? Let that sink in.","kamalaharris","https://instagram.fagc3-2.fna.fbcdn.net/v/t51.2885-19/315353409_535921751294881_4558053708465640219_n.jpg?stp=dst-jpg_s150x150_tt6&_nc_ht=instagram.fagc3-2.fna.fbcdn.net&_nc_cat=1&_nc_oc=Q6cZ2QH2w-kJEBBMg9RrULqDw3CPvwFXq4OcYl5S9YHtSLyyMZJLs_U-NIN6GrbeZ90-5a8&_nc_ohc=8TNz_cljzU8Q7kNvwGsDojS&_nc_gid=jbeGK29qs1TOBfwEw8-rfw&edm=APoiHPcBAAAA&ccb=7-5&oh=00_AfJEvjDuxLl2Zo_fgfG3lle08TY9Bg7zg-4Ts90G6kPDPQ&oe=683BCA08&_nc_sid=22de04","Kamala Harris"
"3480303194823800118_212658006","instagram.com","https://www.instagram.com/kamalaharris/",2988,"DBMhVD2ITU2",FALSE,1080,1080,4270,FALSE,174301,"clips",2,NA,TRUE,"Donald Trump is increasingly unstable. He is unfit to be President of the United States.","kamalaharris","https://instagram.fagc3-2.fna.fbcdn.net/v/t51.2885-19/315353409_535921751294881_4558053708465640219_n.jpg?stp=dst-jpg_s150x150_tt6&_nc_ht=instagram.fagc3-2.fna.fbcdn.net&_nc_cat=1&_nc_oc=Q6cZ2QH2w-kJEBBMg9RrULqDw3CPvwFXq4OcYl5S9YHtSLyyMZJLs_U-NIN6GrbeZ90-5a8&_nc_ohc=8TNz_cljzU8Q7kNvwGsDojS&_nc_gid=jbeGK29qs1TOBfwEw8-rfw&edm=APoiHPcBAAAA&ccb=7-5&oh=00_AfJEvjDuxLl2Zo_fgfG3lle08TY9Bg7zg-4Ts90G6kPDPQ&oe=683BCA08&_nc_sid=22de04","Kamala Harris"
"3480263601290773760_212658006","instagram.com","https://www.instagram.com/kamalaharris/",2989,"DBMYU5fqIUA",FALSE,1080,1080,3679,FALSE,103544,"clips",2,NA,TRUE,"My entire career, I have worked to support our HBCUs, expand access to health care, address Black maternal mortality, invest in our small businesses, and achieve the lowest Black unemployment rate ever in our country. I will do the same as president.","kamalaharris","https://instagram.fagc3-2.fna.fbcdn.net/v/t51.2885-19/315353409_535921751294881_4558053708465640219_n.jpg?stp=dst-jpg_s150x150_tt6&_nc_ht=instagram.fagc3-2.fna.fbcdn.net&_nc_cat=1&_nc_oc=Q6cZ2QH2w-kJEBBMg9RrULqDw3CPvwFXq4OcYl5S9YHtSLyyMZJLs_U-NIN6GrbeZ90-5a8&_nc_ohc=8TNz_cljzU8Q7kNvwGsDojS&_nc_gid=jbeGK29qs1TOBfwEw8-rfw&edm=APoiHPcBAAAA&ccb=7-5&oh=00_AfJEvjDuxLl2Zo_fgfG3lle08TY9Bg7zg-4Ts90G6kPDPQ&oe=683BCA08&_nc_sid=22de04","Kamala Harris"
"3480217554712187331_212658006","instagram.com","https://www.instagram.com/kamalaharris/",2990,"DBMN21RstHD",FALSE,1080,1080,3083,FALSE,61768,"feed",1,NA,NA,"What is he talking about?","kamalaharris","https://instagram.fagc3-2.fna.fbcdn.net/v/t51.2885-19/315353409_535921751294881_4558053708465640219_n.jpg?stp=dst-jpg_s150x150_tt6&_nc_ht=instagram.fagc3-2.fna.fbcdn.net&_nc_cat=1&_nc_oc=Q6cZ2QH2w-kJEBBMg9RrULqDw3CPvwFXq4OcYl5S9YHtSLyyMZJLs_U-NIN6GrbeZ90-5a8&_nc_ohc=8TNz_cljzU8Q7kNvwGsDojS&_nc_gid=jbeGK29qs1TOBfwEw8-rfw&edm=APoiHPcBAAAA&ccb=7-5&oh=00_AfJEvjDuxLl2Zo_fgfG3lle08TY9Bg7zg-4Ts90G6kPDPQ&oe=683BCA08&_nc_sid=22de04","Kamala Harris"
"3480163461888272513_223349035","instagram.com","https://www.instagram.com/kamalaharris/",2991,"DBMBjraJOiB",FALSE,1920,1080,830,FALSE,44626,"clips",2,NA,TRUE,"Brought the Harris-Emhoff guys group chat to life for a family breakfast. I love these guys.","douglasemhoff","https://scontent-lga3-3.cdninstagram.com/v/t51.2885-19/117384348_162715458752770_1532173197034358071_n.jpg?stp=dst-jpg_s150x150_tt6&_nc_ht=scontent-lga3-3.cdninstagram.com&_nc_cat=110&_nc_oc=Q6cZ2QH2w-kJEBBMg9RrULqDw3CPvwFXq4OcYl5S9YHtSLyyMZJLs_U-NIN6GrbeZ90-5a8&_nc_ohc=KoK7yus-E-wQ7kNvwF_WTf_&_nc_gid=jbeGK29qs1TOBfwEw8-rfw&edm=APoiHPcBAAAA&ccb=7-5&oh=00_AfLY_s6JjX5Mtut1h18lZuJDppgjQFNzlqhdzU2VkUxThg&oe=683BC004&_nc_sid=22de04","Doug Emhoff"
